{
  "$schema": "https://json-schema.org/draft/2020-12/schema",
  "$id": "https://skillonomia.dev/schema/skill-package-v1.schema.json",
  "type": "object", "additionalProperties": false,
  "required": ["skill_id","semantic_version","title","capability_statement","owner",
               "author_agent","created_at","license","access_policy",
               "scope","runtime","procedure","evidence","safety","lifecycle","integrity"],
  "properties": {
    "skill_id": {"$ref": "#/$defs/ulid"},
    "semantic_version": {"type": "string", "pattern": "^\\d+\\.\\d+\\.\\d+(-[0-9A-Za-z.-]+)?$"},
    "title": {"type": "string", "minLength": 3, "maxLength": 120},
    "capability_statement": {"type": "string", "minLength": 20, "maxLength": 1000},
    "owner": {"type": "string", "minLength": 1, "maxLength": 120},
    "author_agent": {"$ref": "#/$defs/ulid"},
    "created_at": {"type": "string", "format": "date-time"},
    "license": {"type": "string", "minLength": 3, "maxLength": 64},
    "access_policy": {"enum": ["private","invite","workspace","public"]},
    "did_vc_binding": {"type": "string"},
    "external_aliases": {"type": "array", "items": {"type": "string"}, "maxItems": 16},
    "scope": {"type": "object", "additionalProperties": false,
      "required": ["problem_class","non_goals","prerequisites","risk_level","required_approvals"],
      "properties": {
        "problem_class": {"type": "string", "minLength": 10, "maxLength": 500},
        "non_goals": {"type": "array", "items": {"type": "string"}, "minItems": 1},
        "prerequisites": {"type": "array", "items": {"type": "string"}},
        "risk_level": {"enum": ["low","medium","high"]},
        "required_approvals": {"type": "array", "items": {"enum": ["publish","adopt_high_risk"]}},
        "persona": {"type": "string"}, "maturity_tier": {"enum": ["experimental","stable","hardened"]}}},
    "runtime": {"type": "object", "additionalProperties": false,
      "required": ["model_compat","runtime_compat","tool_compat","os","shell",
                   "cloud_iam_assumptions","mcp_dependencies"],
      "properties": {
        "model_compat": {"$ref": "#/$defs/matcherList"},
        "runtime_compat": {"$ref": "#/$defs/matcherList"},
        "tool_compat": {"$ref": "#/$defs/matcherList"},
        "os": {"type": "array", "items": {"enum": ["linux","macos","windows"]}, "minItems": 1},
        "shell": {"type": "array", "items": {"enum": ["bash","zsh","sh","powershell","none"]}, "minItems": 1},
        "cloud_iam_assumptions": {"type": "array", "items": {"type": "string"}},
        "mcp_dependencies": {"type": "array", "items": {"type": "object", "additionalProperties": false,
          "required": ["registry_id","version"],
          "properties": {"registry_id": {"type": "string"}, "version": {"$ref": "#/$defs/exactVersion"}}}},
        "a2a_agent_card_refs": {"type": "array", "items": {"type": "string"}}}},
    "procedure": {"type": "object", "additionalProperties": false,
      "required": ["steps","expected_outputs","validation_gates","rollback","failure_modes","tools_used"],
      "properties": {
        "steps": {"type": "array", "minItems": 1, "items": {"type": "object", "additionalProperties": false,
          "required": ["n","instruction"], "properties": {
            "n": {"type": "integer", "minimum": 1}, "instruction": {"type": "string", "minLength": 5},
            "command": {"type": "string"}, "expected": {"type": "string"}}}},
        "expected_outputs": {"type": "array", "items": {"type": "string"}, "minItems": 1},
        "validation_gates": {"type": "array", "minItems": 1, "items": {"type": "object",
          "additionalProperties": false, "required": ["gate_id","check","pass_criteria"],
          "properties": {"gate_id": {"type": "string"}, "check": {"type": "string"},
                          "pass_criteria": {"type": "string"}}}},
        "rollback": {"type": "array", "items": {"type": "string"}, "minItems": 1},
        "failure_modes": {"type": "array", "items": {"type": "object", "additionalProperties": false,
          "required": ["mode","symptom","mitigation"], "properties": {
            "mode": {"type": "string"}, "symptom": {"type": "string"}, "mitigation": {"type": "string"}}}},
        "tools_used": {"$ref": "#/$defs/matcherList"},
        "scripts": {"type": "array", "items": {"type": "string"}},
        "deterministic_fixtures": {"type": "array", "items": {"type": "string"}}}},
    "evidence": {"type": "object", "additionalProperties": false,
      "required": ["summary","test_results","redaction_level"],
      "properties": {
        "summary": {"type": "string", "minLength": 20},
        "test_results": {"type": "string"},
        "redaction_level": {"enum": ["none","standard","strict"]},
        "signed_trace_hash": {"$ref": "#/$defs/hex64"},
        "benchmark": {"type": "string"}, "third_party_attestation": {"type": "string"}}},
    "safety": {"type": "object", "additionalProperties": false,
      "required": ["forbidden_actions","secrets_policy","dependency_manifest",
                   "url_allowlist","sandbox_requirement"],
      "properties": {
        "forbidden_actions": {"type": "array", "items": {"type": "string"}},
        "secrets_policy": {"type": "string", "minLength": 10},
        "dependency_manifest": {"type": "array", "items": {"type": "object", "additionalProperties": false,
          "required": ["name","version"], "properties": {
            "name": {"type": "string"}, "version": {"$ref": "#/$defs/exactVersion"},
            "ecosystem": {"type": "string"}}}},
        "url_allowlist": {"type": "array", "items": {"type": "string", "format": "uri"}},
        "sandbox_requirement": {"enum": ["none","recommended","required"]},
        "slsa_intoto_provenance": {"type": "string"}, "sigstore_signatures": {"type": "string"}}},
    "lifecycle": {"type": "object", "additionalProperties": false, "required": ["supersedes"],
      "properties": {"supersedes": {"oneOf": [{"$ref": "#/$defs/ulid"}, {"type": "null"}]},
                      "dispute_state": {"type": "string"}}},
    "integrity": {"type": "array", "items": {"type": "object", "additionalProperties": false,
      "required": ["path","sha256"], "properties": {
        "path": {"type": "string", "pattern": "^(?!/)(?!.*\\.\\.)[^\\\\]+$"},
        "sha256": {"$ref": "#/$defs/hex64"}}}},
    "outcome_contract": {"type": "object", "additionalProperties": false,
      "required": ["check","evidence","unknown"], "properties": {
        "check": {"type": "object", "additionalProperties": false, "required": ["kind"], "properties": {
          "kind": {"enum": ["exit_code","stdout_match","artifact_exists","command"]},
          "exit_code": {"type": "integer", "minimum": 0, "maximum": 255},
          "stdout_match": {"type": "string", "minLength": 1, "maxLength": 400},
          "artifact_path": {"type": "string", "pattern": "^(?!/)(?!.*\\.\\.)[^\\\\]+$", "maxLength": 400},
          "command": {"type": "string", "minLength": 1, "maxLength": 400}}},
        "evidence": {"type": "array", "minItems": 1, "maxItems": 20,
          "items": {"type": "string", "minLength": 1, "maxLength": 80}},
        "unknown": {"type": "string", "minLength": 10, "maxLength": 400}}},
    "x_ext": {"type": "object"}
  },
  "$defs": {
    "ulid": {"type": "string", "pattern": "^[0-9A-HJKMNP-TV-Z]{26}$"},
    "hex64": {"type": "string", "pattern": "^[0-9a-f]{64}$"},
    "exactVersion": {"type": "string", "pattern": "^\\d+\\.\\d+\\.\\d+(-[0-9A-Za-z.-]+)?$"},
    "matcherList": {"type": "array", "items": {"type": "object", "additionalProperties": false,
      "required": ["id","range"], "properties": {
        "id": {"type": "string", "minLength": 1, "maxLength": 80},
        "range": {"type": "string", "minLength": 1, "maxLength": 40}}}}
  }
}
