{"access_policy":"workspace","author_agent":"01SEED00000000000000000000","capability_statement":"Built-in seed package: run one deterministic fixture command and verify its output against a declared gate.","created_at":"2026-08-01T00:00:00Z","evidence":{"redaction_level":"none","summary":"Deterministic fixture prints a fixed string; gate g1 compares stdout.","test_results":"local: g1 pass"},"integrity":[{"path":"SKILL.md","sha256":"0bf0304d6c844a4f79ad46902165eba2d7807e2015841ebc5353fa40fd152454"},{"path":"fixtures/tv01.sh","sha256":"956e69331b9fb00e1d465eda3c6a8ed508163fe90428541e3b6d4c645529b360"}],"license":"Apache-2.0","lifecycle":{"supersedes":null},"owner":"skillonomia","procedure":{"expected_outputs":["skillonomia-tv01-ok"],"failure_modes":[{"mitigation":"install a POSIX shell","mode":"shell-missing","symptom":"sh not found"}],"rollback":["No changes made; nothing to roll back."],"steps":[{"command":"sh fixtures/tv01.sh","expected":"skillonomia-tv01-ok","instruction":"Run the fixture script.","n":1}],"tools_used":[{"id":"shell","range":"*"}],"validation_gates":[{"check":"stdout equals expected string","gate_id":"g1","pass_criteria":"stdout == 'skillonomia-tv01-ok'"}]},"runtime":{"cloud_iam_assumptions":[],"mcp_dependencies":[],"model_compat":[{"id":"any","range":"*"}],"os":["linux","macos"],"runtime_compat":[{"id":"any","range":"*"}],"shell":["bash","sh"],"tool_compat":[{"id":"shell","range":"*"}]},"safety":{"dependency_manifest":[],"forbidden_actions":["network access","file writes outside workdir"],"sandbox_requirement":"none","secrets_policy":"No secrets used or accepted.","url_allowlist":[]},"scope":{"non_goals":["Any production use"],"prerequisites":[],"problem_class":"Smoke-testing a Skillonomia deployment end to end.","required_approvals":[],"risk_level":"low"},"semantic_version":"1.0.0","skill_id":"01SEEDPACKAGE0000000000000","title":"hello-skillonomia"}