{
  "title": "TV-01 hello-skillonomia",
  "skill_id": "01TVSK0000000000000000000A",
  "semantic_version": "1.0.0",
  "scope": {
    "non_goals": [
      "Any production use"
    ],
    "prerequisites": [],
    "problem_class": "Smoke-testing a Skillonomia deployment end to end.",
    "required_approvals": [],
    "risk_level": "low"
  },
  "safety": {
    "dependency_manifest": [],
    "forbidden_actions": [
      "network access",
      "file writes outside workdir"
    ],
    "sandbox_requirement": "none",
    "secrets_policy": "No secrets used or accepted.",
    "url_allowlist": []
  },
  "runtime": {
    "cloud_iam_assumptions": [],
    "mcp_dependencies": [],
    "model_compat": [
      {
        "id": "any",
        "range": "*"
      }
    ],
    "os": [
      "linux",
      "macos"
    ],
    "runtime_compat": [
      {
        "id": "any",
        "range": "*"
      }
    ],
    "shell": [
      "bash",
      "sh"
    ],
    "tool_compat": [
      {
        "id": "shell",
        "range": "*"
      }
    ]
  },
  "procedure": {
    "expected_outputs": [
      "skillonomia-tv01-ok"
    ],
    "failure_modes": [
      {
        "mitigation": "install a POSIX shell",
        "mode": "shell-missing",
        "symptom": "sh not found"
      }
    ],
    "rollback": [
      "No changes made; nothing to roll back."
    ],
    "steps": [
      {
        "command": "sh fixtures/tv01.sh",
        "expected": "skillonomia-tv01-ok",
        "instruction": "Run the fixture script.",
        "n": 1
      }
    ],
    "tools_used": [
      {
        "id": "shell",
        "range": "*"
      }
    ],
    "validation_gates": [
      {
        "check": "stdout equals expected string",
        "gate_id": "g1",
        "pass_criteria": "stdout == 'skillonomia-tv01-ok'"
      }
    ]
  },
  "owner": "tv-workspace",
  "lifecycle": {
    "supersedes": null
  },
  "license": "Apache-2.0",
  "integrity": [
    {
      "path": "SKILL.md",
      "sha256": "9aa9fcc8c19358ef683f752e3dc2f5462661f3e4770a80b484737d8528cafbbb"
    },
    {
      "path": "fixtures/tv01.sh",
      "sha256": "956e69331b9fb00e1d465eda3c6a8ed508163fe90428541e3b6d4c645529b360"
    }
  ],
  "evidence": {
    "redaction_level": "none",
    "summary": "Deterministic fixture prints a fixed string; gate g1 compares stdout.",
    "test_results": "local: g1 pass"
  },
  "created_at": "2026-08-01T00:00:00Z",
  "capability_statement": "Deterministic low-risk test-vector skill: run one fixture command and verify its output.",
  "author_agent": "01TVAG0000000000000000000A",
  "access_policy": "workspace"
}